{
  "$schema": "https://json-schema.org/draft/2020-12/schema",
  "$id": "https://verifrax.github.io/tachyrium/schemas/boundary-policy.schema.json",
  "title": "TACHYRIUM Boundary Policy",
  "type": "object",
  "additionalProperties": false,
  "required": [
    "object_type",
    "surface",
    "schema_version",
    "state_type",
    "role",
    "allowed_inputs",
    "allowed_output_classes",
    "forbidden_output_classes",
    "required_boundary_assertions",
    "rejection_reasons",
    "adjacent_sovereign_surfaces",
    "review_rule"
  ],
  "properties": {
    "object_type": {
      "const": "BOUNDARY_POLICY"
    },
    "surface": {
      "const": "TACHYRIUM"
    },
    "schema_version": {
      "type": "string",
      "pattern": "^\\d+\\.\\d+\\.\\d+$"
    },
    "state_type": {
      "enum": [
        "ACTIVE_TRUTH"
      ]
    },
    "role": {
      "const": "bounded-sovereign-cognition"
    },
    "allowed_inputs": {
      "type": "array",
      "minItems": 1,
      "uniqueItems": true,
      "items": {
        "enum": [
          "constitutional-law-reference",
          "accepted-state-reference",
          "reconciliation-report",
          "repository-surface",
          "host-surface",
          "package-surface",
          "evidence-surface",
          "operator-request",
          "topology-request",
          "candidate-generation-request"
        ]
      }
    },
    "allowed_output_classes": {
      "type": "array",
      "minItems": 1,
      "uniqueItems": true,
      "items": {
        "enum": [
          "briefing",
          "candidate-object",
          "classification-summary",
          "contradiction-analysis",
          "topology-summary",
          "routing-candidate",
          "cognition-output-record",
          "cognition-audit-record"
        ]
      }
    },
    "forbidden_output_classes": {
      "type": "array",
      "minItems": 1,
      "uniqueItems": true,
      "items": {
        "enum": [
          "law-object",
          "accepted-state-object",
          "authority-object",
          "execution-receipt",
          "verification-verdict",
          "recognition-object",
          "recourse-object",
          "proof-publication-object",
          "intake-decision-object"
        ]
      }
    },
    "required_boundary_assertions": {
      "type": "array",
      "minItems": 1,
      "uniqueItems": true,
      "items": {
        "enum": [
          "not-law",
          "not-state",
          "not-authority",
          "not-execution",
          "not-verification",
          "not-recognition",
          "not-recourse",
          "not-proof",
          "not-intake",
          "reviewable-subordinate-output"
        ]
      }
    },
    "rejection_reasons": {
      "type": "array",
      "minItems": 1,
      "uniqueItems": true,
      "items": {
        "enum": [
          "input-class-unsupported",
          "output-class-unsupported",
          "would-author-law",
          "would-mutate-accepted-state",
          "would-issue-authority",
          "would-execute-governed-action",
          "would-emit-verification-verdict",
          "would-recognize-terminal-truth",
          "would-assign-terminal-recourse",
          "would-publish-proof-authority",
          "would-operate-intake-authority"
        ]
      }
    },
    "adjacent_sovereign_surfaces": {
      "type": "object",
      "additionalProperties": false,
      "required": [
        "law",
        "state",
        "reconciliation",
        "authority",
        "execution",
        "verification",
        "recognition",
        "recourse"
      ],
      "properties": {
        "law": { "const": "SYNTAGMARIUM" },
        "state": { "const": "ORBISTIUM" },
        "reconciliation": { "const": "CONSONORIUM" },
        "authority": { "const": "AUCTORISEAL" },
        "execution": { "const": "CORPIFORM" },
        "verification": { "const": "VERIFRAX" },
        "recognition": { "const": "ANAGNORIUM" },
        "recourse": { "const": "REGRESSORIUM" }
      }
    },
    "review_rule": {
      "const": "subordinate-output-requires-downstream-review"
    }
  }
}
